{
  "schema_version": "tscb.codec-manifest.v2",
  "key": "sprintz-fire",
  "identity": {
    "display_name": "Sprintz-FIRE/XFF (native 8/16-bit integer UTS/MTS)",
    "family": "SPRINTZ_FIRE",
    "citations": [
      "benchmark:dblalock/lzbench@580c4f08:_lzbench/compressors.cpp:sprintzXff",
      "upstream:dblalock/sprintz@a056cdb6:sprintz/sprintz.cpp"
    ],
    "source_artifact_id": "v2:source-artifact:sha256:a26eb4d896ea01cb2ad8e239fbe4ba922ab54a2d524a6c2b53fe03385e22718d"
  },
  "classification": {
    "object_level": "P1_STANDALONE_CODEC",
    "implementation_class": "CONVENTIONAL",
    "tracks": [
      "VALUE"
    ],
    "subtracks": [
      "V0"
    ]
  },
  "input": {
    "topologies": [
      "UTS",
      "SYNCHRONOUS_MTS"
    ],
    "dtypes": [
      "|i1",
      "|u1",
      "<i2",
      "<u2"
    ],
    "ranks": [
      1,
      2
    ],
    "layouts": [
      "ROW_MAJOR_CONTIG",
      "SOA_COLUMNS"
    ],
    "endianness": [
      "little"
    ],
    "alignment_bytes": 1,
    "min_n": 0,
    "max_n": 131072,
    "min_m": 1,
    "max_m": 128,
    "validity_shapes": [
      "NONE"
    ],
    "homogeneous_itemsize": true,
    "value_coupling_mode": "FULL_MATRIX",
    "timestamp_semantics": {
      "preserve_order": true,
      "duplicates": true,
      "out_of_order": true,
      "negative_delta": true,
      "absolute_epoch": true,
      "overflow_policy": "NOT_APPLICABLE_VALUE_ONLY"
    }
  },
  "semantics": {
    "loss_modes": [
      "LOSSLESS"
    ],
    "error_bound_types": [],
    "reconstruction_modes": [
      "EXACT_GRID"
    ],
    "rebuild_protocol": "TSCB_SPRINTZ_DESCRIPTOR_V2",
    "preprocess_class": "NONE",
    "preprocess_stages": [],
    "decodability_profile": "SELF_CONTAINED_DESCRIPTOR_NATIVE_ENVELOPE_AND_RLE_HEADER",
    "bitstream_separability": "INDEPENDENT"
  },
  "lifecycle": {
    "block_semantics": "ONE_NATIVE_ROW_MAJOR_RLE_STREAM_PER_VALUE_OBJECT",
    "state_semantics": "INDEPENDENT_CONTEXT_PER_REPETITION",
    "reset": "NEW_CONTEXT_REQUIRED",
    "finalize": "REQUIRED_ZERO_BYTE_FINALIZE",
    "safe_overread_bytes": 0,
    "tail_policy": "EXACT_LENGTH",
    "dictionary": "NONE",
    "model": "NONE",
    "index": "NONE"
  },
  "execution": {
    "backends": [
      "C_ABI_V1"
    ],
    "isa": [
      "AVX2_BMI2_LZCNT"
    ],
    "devices": [
      "CPU"
    ],
    "threading": "SINGLE_THREAD",
    "fallback_policy": "DISALLOWED",
    "runtime_dispatch": false
  },
  "features": {
    "streaming": false,
    "query": false,
    "random_access": false
  },
  "parameters": {
    "type": "object",
    "additionalProperties": false,
    "properties": {
      "native_timing": {
        "type": "boolean",
        "default": true
      },
      "isa": {
        "type": "string",
        "enum": [
          "AVX2_BMI2_LZCNT"
        ],
        "default": "AVX2_BMI2_LZCNT"
      }
    },
    "constraints": []
  },
  "adapter": {
    "backend": "C_ABI_V1",
    "version": "sprintz-ctypes-v2-port-standard-v30-20261011",
    "factory": "SPRINTZ_CTYPES_V1",
    "artifact_path": "build/port-standard-v30-20261011/native-builds-v3/sprintz_fire/release/libtscb_sprintz_fire.so",
    "timing_boundary": "PYTHON_SOA_INTERLEAVE_FFI_AND_CONTAINER_INCLUDED",
    "native_timing_capability": {
      "optional": true,
      "boundary": "CODEC_API_ONLY_V1",
      "clock": "CLOCK_MONOTONIC",
      "excludes": [
        "CONTEXT_LIFECYCLE",
        "PYTHON_SOA_INTERLEAVE",
        "PYTHON_FFI_CONTAINER"
      ]
    },
    "accounting_hooks": [
      "FINAL_STREAM_LENGTH",
      "NATIVE_ENVELOPE",
      "NATIVE_HEADER",
      "OUTPUT_CAPACITY"
    ]
  }
}
