{
  "schema_version": "tscb.codec-manifest.v2",
  "key": "lz4-frame",
  "identity": {
    "display_name": "LZ4 Frame 1.10.0 (lzbench source)",
    "family": "LZ4",
    "citations": [
      "benchmark:inikep/lzbench@fa871e66b354:lz/lz4",
      "upstream:lz4/lz4:frame-format"
    ],
    "source_artifact_id": "v2:source-artifact:sha256:68693355ce70e7eb3c672bb55303b7d380d420e3ec0626a4cef0588556f62679"
  },
  "classification": {
    "object_level": "P1_STANDALONE_CODEC",
    "implementation_class": "CONVENTIONAL",
    "tracks": [
      "TIMESTAMP",
      "VALUE"
    ],
    "subtracks": [
      "T1",
      "V0"
    ]
  },
  "input": {
    "topologies": [
      "UTS",
      "SYNCHRONOUS_MTS",
      "NATIVE_ND_ARRAY"
    ],
    "dtypes": [
      "<i8",
      "<i4",
      "<i2",
      "|i1",
      "<u8",
      "<u4",
      "<u2",
      "|u1",
      "<f8",
      "<f4"
    ],
    "ranks": [
      1,
      2,
      3,
      4
    ],
    "layouts": [
      "ROW_MAJOR_CONTIG",
      "COLUMN_MAJOR_CONTIG",
      "SOA_COLUMNS",
      "STRIDED_VIEW",
      "NOT_APPLICABLE"
    ],
    "endianness": [
      "little"
    ],
    "alignment_bytes": 1,
    "min_n": 0,
    "max_n": 9223372036854775807,
    "min_m": 1,
    "max_m": 1048576,
    "validity_shapes": [
      "NONE"
    ],
    "value_coupling_mode": "FULL_MATRIX",
    "timestamp_semantics": {
      "preserve_order": true,
      "duplicates": true,
      "out_of_order": true,
      "negative_delta": true,
      "absolute_epoch": true,
      "overflow_policy": "NOT_APPLICABLE_BYTE_CODEC"
    }
  },
  "semantics": {
    "loss_modes": [
      "LOSSLESS"
    ],
    "error_bound_types": [],
    "reconstruction_modes": [
      "EXACT_GRID"
    ],
    "rebuild_protocol": "TSCB_BUFFER_DESCRIPTOR_CONTAINER_V1",
    "preprocess_class": "NONE",
    "preprocess_stages": [],
    "decodability_profile": "SELF_CONTAINED_TSCB_DESCRIPTOR_PLUS_CODEC_FRAME",
    "bitstream_separability": "INDEPENDENT"
  },
  "lifecycle": {
    "block_semantics": "ONE_SELF_CONTAINED_FRAME_PER_ROUTED_OBJECT",
    "state_semantics": "INDEPENDENT_CONTEXT_PER_REPETITION",
    "reset": "NEW_CONTEXT_REQUIRED",
    "finalize": "REQUIRED_LZ4F_COMPRESS_END",
    "safe_overread_bytes": 0,
    "tail_policy": "CODEC_INTERNAL_EXACT_TAIL",
    "dictionary": "NONE",
    "model": "NONE",
    "index": "NONE"
  },
  "execution": {
    "backends": [
      "C_ABI_V1"
    ],
    "isa": [
      "SCALAR"
    ],
    "devices": [
      "CPU"
    ],
    "threading": "SINGLE_THREAD",
    "fallback_policy": "DISALLOWED",
    "runtime_dispatch": false
  },
  "features": {
    "streaming": true,
    "query": false,
    "random_access": false
  },
  "parameters": {
    "type": "object",
    "additionalProperties": false,
    "properties": {
      "native_timing": {
        "type": "boolean",
        "default": true
      },
      "block_size": {
        "type": "integer",
        "minimum": 1,
        "maximum": 1048576,
        "default": 65536
      },
      "stream_decode_chunk_bytes": {
        "type": "integer",
        "minimum": 1,
        "maximum": 1048576,
        "default": 16384
      },
      "compression_level": {
        "type": "integer",
        "minimum": 0,
        "maximum": 12,
        "default": 0
      },
      "block_size_id": {
        "type": "integer",
        "enum": [
          4,
          5,
          6,
          7
        ],
        "default": 4
      },
      "block_mode": {
        "type": "string",
        "enum": [
          "INDEPENDENT",
          "LINKED"
        ],
        "default": "INDEPENDENT"
      },
      "content_checksum": {
        "type": "boolean",
        "default": true
      },
      "block_checksum": {
        "type": "boolean",
        "default": false
      },
      "isa": {
        "type": "string",
        "enum": [
          "SCALAR"
        ],
        "default": "SCALAR"
      }
    },
    "constraints": []
  },
  "adapter": {
    "backend": "C_ABI_V1",
    "version": "lz4-frame-ctypes-v2-streaming-port-standard-v30-20261011",
    "factory": "LZ4_FRAME_CTYPES_V1",
    "artifact_path": "build/port-standard-v30-20261011/native-builds-v3/lz4_frame/release/libtscb_lz4_frame.so",
    "timing_boundary": "PYTHON_FFI_CONTAINER_INCLUDED",
    "native_timing_capability": {
      "optional": true,
      "boundary": "CODEC_API_ONLY_V1",
      "clock": "CLOCK_MONOTONIC",
      "excludes": [
        "CONTEXT_LIFECYCLE",
        "EXPLICIT_PREVALIDATION",
        "PYTHON_FFI_CONTAINER"
      ]
    },
    "accounting_hooks": [
      "FINAL_STREAM_INSPECTION",
      "LZ4_FRAME_COMPONENTS",
      "OUTPUT_CAPACITY"
    ]
  }
}
