{
  "schema_version": "tscb.codec-manifest.v2",
  "key": "sprintz-fire-u8",
  "identity": {
    "display_name": "Sprintz-FIRE/XFF (native unsigned 8-bit UTS)",
    "family": "SPRINTZ_FIRE",
    "citations": [
      "benchmark:dblalock/lzbench@580c4f08:_lzbench/compressors.cpp:sprintzXff"
    ],
    "source_artifact_id": "v2:source-artifact:sha256:af92b504c16f247d9e34136d14a489b47d26610edee41353c663297ea9a9ad5a"
  },
  "classification": {
    "object_level": "P1_STANDALONE_CODEC",
    "implementation_class": "CONVENTIONAL",
    "tracks": [
      "VALUE"
    ],
    "subtracks": [
      "V0"
    ]
  },
  "input": {
    "topologies": [
      "UTS"
    ],
    "dtypes": [
      "|u1"
    ],
    "ranks": [
      1
    ],
    "layouts": [
      "ROW_MAJOR_CONTIG"
    ],
    "endianness": [
      "little"
    ],
    "alignment_bytes": 1,
    "min_n": 0,
    "max_n": 131072,
    "min_m": 1,
    "max_m": 1,
    "validity_shapes": [
      "NONE"
    ],
    "value_coupling_mode": "COLUMN_INDEPENDENT",
    "timestamp_semantics": {
      "preserve_order": true,
      "duplicates": true,
      "out_of_order": true,
      "negative_delta": true,
      "absolute_epoch": true,
      "overflow_policy": "NOT_APPLICABLE_VALUE_ONLY"
    }
  },
  "semantics": {
    "loss_modes": [
      "LOSSLESS"
    ],
    "error_bound_types": [],
    "reconstruction_modes": [
      "EXACT_GRID"
    ],
    "rebuild_protocol": "TSCB_SPRINTZ_U8_DESCRIPTOR_V1",
    "preprocess_class": "NONE",
    "preprocess_stages": [],
    "decodability_profile": "SELF_CONTAINED_DESCRIPTOR_AND_NATIVE_8B_RLE_HEADER",
    "bitstream_separability": "INDEPENDENT"
  },
  "lifecycle": {
    "block_semantics": "ONE_NATIVE_8BIT_RLE_STREAM_PER_UTS_OBJECT",
    "state_semantics": "INDEPENDENT_CONTEXT_PER_REPETITION",
    "reset": "NEW_CONTEXT_REQUIRED",
    "finalize": "REQUIRED_ZERO_BYTE_FINALIZE",
    "safe_overread_bytes": 0,
    "tail_policy": "EXACT_LENGTH",
    "dictionary": "NONE",
    "model": "NONE",
    "index": "NONE"
  },
  "execution": {
    "backends": [
      "C_ABI_V1"
    ],
    "isa": [
      "AVX2_BMI2_LZCNT"
    ],
    "devices": [
      "CPU"
    ],
    "threading": "SINGLE_THREAD",
    "fallback_policy": "DISALLOWED",
    "runtime_dispatch": false
  },
  "features": {
    "streaming": false,
    "query": false,
    "random_access": false
  },
  "parameters": {
    "type": "object",
    "additionalProperties": false,
    "properties": {
      "native_timing": {
        "type": "boolean",
        "default": true
      },
      "block_size": {
        "type": "integer",
        "minimum": 1,
        "maximum": 131072,
        "default": 128
      },
      "isa": {
        "type": "string",
        "enum": [
          "AVX2_BMI2_LZCNT"
        ],
        "default": "AVX2_BMI2_LZCNT"
      }
    },
    "constraints": []
  },
  "adapter": {
    "backend": "C_ABI_V1",
    "version": "sprintz-u8-ctypes-v1-port-standard-v30-20261011",
    "factory": "SPRINTZ8_CTYPES_V1",
    "artifact_path": "build/port-standard-v30-20261011/native-builds-v3/sprintz_fire_u8/release/libtscb_sprintz_fire_u8.so",
    "timing_boundary": "PYTHON_FFI_CONTAINER_INCLUDED",
    "native_timing_capability": {
      "optional": true,
      "boundary": "CODEC_API_ONLY_V1",
      "clock": "CLOCK_MONOTONIC",
      "excludes": [
        "CONTEXT_LIFECYCLE",
        "PYTHON_FFI_CONTAINER"
      ]
    },
    "accounting_hooks": [
      "FINAL_STREAM_LENGTH",
      "NATIVE_HEADER",
      "OUTPUT_CAPACITY"
    ],
    "runtime_profile": {
      "path": "docs/audits/20261011_port_standard_v30/runtime_profiles_v2/profiles/sprintz-fire-u8.json",
      "sha256": "9b8e6cbda31e2adae6ad65db832e6ef7fa0d0b21dae340d93cb274f847d02a48"
    }
  }
}
