{
  "schema_version": "tscb.codec-manifest.v2",
  "key": "elf-star",
  "identity": {
    "display_name": "Elf* (block Huffman)",
    "family": "ELF_STAR",
    "citations": [
      "standalone:Compression_Rewrite/ReWrite/elf-star/contract.md"
    ],
    "source_artifact_id": "v2:source-artifact:sha256:f880d919673dd94f4459a5a2c17d01d9911272d93eec15fbf2c1b4a58537f555"
  },
  "classification": {
    "object_level": "P1_STANDALONE_CODEC",
    "implementation_class": "CONVENTIONAL",
    "tracks": [
      "VALUE"
    ],
    "subtracks": [
      "V0"
    ]
  },
  "input": {
    "topologies": [
      "UTS",
      "SYNCHRONOUS_MTS"
    ],
    "dtypes": [
      "<f4",
      "<f8"
    ],
    "ranks": [
      1,
      2
    ],
    "layouts": [
      "ROW_MAJOR_CONTIG",
      "SOA_COLUMNS"
    ],
    "endianness": [
      "little"
    ],
    "alignment_bytes": 1,
    "min_n": 0,
    "max_n": 16777216,
    "min_m": 1,
    "max_m": 65535,
    "validity_shapes": [
      "NONE"
    ],
    "homogeneous_itemsize": true,
    "max_total_raw_bytes": 134217728,
    "value_coupling_mode": "COLUMN_INDEPENDENT",
    "timestamp_semantics": {
      "preserve_order": true,
      "duplicates": true,
      "out_of_order": true,
      "negative_delta": true,
      "absolute_epoch": true,
      "overflow_policy": "NOT_APPLICABLE_VALUE_ONLY"
    },
    "value_domain": {
      "kind": "FROZEN_SOURCE_WITH_BOUNDED_REJECTION",
      "unsupported_action": "REJECT_BEFORE_OUTPUT",
      "oracle_evidence": "Compression_Rewrite/ReWrite/elf-star/validation/source-domain/report.json",
      "rejection_reasons": [
        "NaN is END, outside lossless domain",
        "source rejects decimal scale",
        "source significance loop does not terminate",
        "source beta symbol outside table",
        "source decimal recovery is not lossless"
      ]
    },
    "max_total_elements": 16777216
  },
  "semantics": {
    "loss_modes": [
      "LOSSLESS"
    ],
    "error_bound_types": [],
    "reconstruction_modes": [
      "EXACT_GRID"
    ],
    "rebuild_protocol": "TSCB_ELF_STAR_FROZEN_API_RWF1_V1",
    "preprocess_class": "NONE",
    "preprocess_stages": [],
    "decodability_profile": "SELF_CONTAINED_DESCRIPTOR_WITH_CHECKED_FROZEN_CODEC_FRAMES",
    "bitstream_separability": "PER_COLUMN_BLOCK"
  },
  "lifecycle": {
    "block_semantics": "CONFIGURED_SAMPLE_BLOCKS_WITH_EXACT_TAIL",
    "state_semantics": "RESET_EACH_BLOCK_AND_COLUMN",
    "reset": "REQUIRED_MODE_ZERO",
    "finalize": "REQUIRED_ZERO_BYTE_FINALIZE",
    "safe_overread_bytes": 0,
    "tail_policy": "EXACT_COUNT",
    "dictionary": "NONE",
    "model": "FROZEN_UPSTREAM_STATE",
    "index": "NONE"
  },
  "execution": {
    "backends": [
      "C_ABI_V1"
    ],
    "isa": [
      "SCALAR"
    ],
    "devices": [
      "CPU"
    ],
    "threading": "SINGLE_THREAD",
    "fallback_policy": "DISALLOWED_SOURCE_DOMAIN_ERRORS_REJECTED",
    "runtime_dispatch": false,
    "timing_scopes": [
      "CORE",
      "PIPELINE",
      "E2E"
    ]
  },
  "features": {
    "streaming": false,
    "query": false,
    "random_access": false
  },
  "parameters": {
    "type": "object",
    "additionalProperties": false,
    "properties": {
      "block_size": {
        "type": "integer",
        "minimum": 1,
        "maximum": 1000,
        "default": 1000
      },
      "isa": {
        "type": "string",
        "enum": [
          "SCALAR"
        ],
        "default": "SCALAR"
      }
    },
    "constraints": []
  },
  "adapter": {
    "backend": "C_ABI_V1",
    "version": "rewrite-lossless-ctypes-v1-port-standard-v30-20261011",
    "factory": "REWRITE_LOSSLESS_CTYPES_V1",
    "artifact_path": "build/port-standard-v30-20261011/native-builds-v3/elf_star/release/libtscb_elf_star.so",
    "timing_boundary": "PYTHON_LAYOUT_FFI_DESCRIPTOR_AND_CHECKED_NATIVE_FRAME_INCLUDED",
    "accounting_hooks": [
      "FINAL_STREAM_LENGTH",
      "DESCRIPTOR_AND_WRAPPER_OVERHEAD",
      "OPAQUE_COMPLETE_STANDALONE_CODEC_BYTES",
      "COLUMN_CODEC_BYTES",
      "OUTPUT_CAPACITY"
    ],
    "timing_scope_boundaries": {
      "CORE": "HARNESS_SESSION_API: compress_update + finalize / decompress; prepared routed input, created session and encode output capacity outside timer; includes API-internal descriptors, staging, copies, native frames, model work and decode materialization; reset via fresh independent session outside timer",
      "PIPELINE": "HARNESS_OBJECT_PIPELINE: compatibility preparation, session creation, bound/capacity allocation, CORE, finalized stream materialization, accounting, native telemetry and close; decode includes inverse compatibility work",
      "E2E": "CANONICAL_MEMORY_ROUTED_VIEW: complete encode/decode object pipeline and phase transitions; excludes file I/O and post-timing correctness/determinism checks",
      "NATIVE": "UNAVAILABLE_NULL: no optional internal native timer; CORE uses harness wall clock, never inferred native duration"
    }
  }
}
